{
  "schemaVersion": 1,
  "generatedAt": "2027-09-01T05:00:00Z",
  "state": "post-first-franc",
  "projectsRegistered": 31,
  "contributorsClaimed": 57,
  "contributorsAttribution": {
    "algoVersion": "PP-v0",
    "provisional": true,
    "month": "2027-07",
    "algorithmNotesUrl": "https://purposesource.org/trust/algorithms"
  },
  "companiesCovered": 14,
  "chfRoutedMinor": 1834500,
  "cur": "CHF",
  "firstDisbursementScheduledFor": null,
  "loi": null,
  "smallnessThresholds": {
    "projects": 25,
    "contributors": 50,
    "companies": 10
  },
  "links": {
    "registry": "https://purposesource.org/registry",
    "ledger": "https://purposesource.org/ledger",
    "waivers": "https://purposesource.org/waivers"
  }
}
